{
  "schemaVersion": "aim-policy-v2",
  "policyVersion": "aim-policy-v2",
  "resultBuilderSemanticVersion": "aim-result-builder-v4",
  "numericGateEnabled": false,
  "administrativeEligibilityExcluded": true,
  "identityHashKinds": {
    "trustedMetadata": "aim_trusted_metadata_v1",
    "sourceIdentity": "aim_source_identity_v1",
    "extractionIdentity": "aim_extraction_identity_v1",
    "evidence": "aim_evidence_v1",
    "factualVector": "aim_factual_vector_v1",
    "localPolicyFacts": "aim_local_policy_facts_v1",
    "localPolicyScoringIdentity": "aim_local_policy_scoring_identity_v1",
    "scoringIdentity": "aim_scoring_identity_v1",
    "semanticResult": "aim_semantic_result_v1"
  },
  "localPolicy": {
    "triggerOrder": [
      "direct_pepsico_employer",
      "direct_att_employer"
    ],
    "employerNormalization": {
      "unicodeCaseFold": true,
      "replaceAmpersandWith": "and",
      "nonLetterDigitReplacement": " ",
      "removeWholeWords": [
        "incorporated",
        "inc",
        "llc",
        "ltd",
        "corp",
        "corporation",
        "company"
      ],
      "collapseSpaces": true,
      "matchMode": "normalized_equality"
    },
    "triggers": [
      {
        "code": "direct_pepsico_employer",
        "directEmploymentOnly": true,
        "normalizedAliases": [
          "pepsico",
          "pepsi co",
          "pepsi-co"
        ]
      },
      {
        "code": "direct_att_employer",
        "directEmploymentOnly": true,
        "normalizedAliases": [
          "at&t",
          "att",
          "at and t"
        ]
      }
    ]
  },
  "stage1": {
    "triggerOrder": [
      "S1.Q01",
      "S1.Q02",
      "S1.Q03",
      "S1.Q04",
      "S1.Q05",
      "S1.Q06",
      "S1.Q07"
    ],
    "unconditionalYesKills": [
      "S1.Q01",
      "S1.Q02",
      "S1.Q03",
      "S1.Q04",
      "S1.Q05",
      "S1.Q07"
    ],
    "conditionalYes": {
      "S1.Q06": {
        "parser": "local_insurance_agency_v1",
        "killState": "local_agency",
        "failOpenStates": [
          "not_local_or_not_agency",
          "unknown"
        ]
      }
    },
    "localInsuranceAgencyPolicy": {
      "version": "local-insurance-agency-policy-v1",
      "directEmployerLexemes": [
        "insurance agency",
        "insurance sales office"
      ],
      "localGeographyLexemes": [
        "local",
        "neighborhood",
        "community",
        "agent office",
        "agency office"
      ],
      "exactEmployerOfficeAliases": [],
      "insufficientEmployerTypes": [
        "carrier",
        "insurer",
        "broker",
        "customer",
        "partner",
        "national agency"
      ],
      "independentAgencyAloneIsLocal": false
    }
  },
  "stage2Projection": {
    "version": "aim-stage2-source-to-score-fact-v2",
    "crosswalkSchemaVersion": "aim-question-crosswalk-v2",
    "crosswalkHash": "a978a9ef4d16231dd215ed63c885e7246dbc2d842668bf1545987071e878d4b3",
    "sourceQuestionCount": 342,
    "derivedQuestionCount": 157,
    "derivedOnlyQuestionIds": [
      "S2.CML.Q18",
      "S2.CML.Q24",
      "S2.BA.Q23",
      "S2.BA.Q24"
    ]
  },
  "machineEvidenceGuards": {
    "version": "aim-machine-evidence-guards-v1",
    "primaryOrMajorityPhrases": [
      "primary",
      "primarily",
      "majority",
      "most of",
      "main responsibility",
      "core responsibility"
    ],
    "governingHeadingPhrases": [
      "primary responsibilities",
      "main responsibilities",
      "core responsibilities"
    ],
    "questionGuards": {
      "S1.Q02": {
        "kind": "primary_activity_same_scope",
        "activityLexemes": [
          "inside sales"
        ]
      },
      "S1.Q04": {
        "kind": "primary_activity_same_scope",
        "activityLexemes": [
          "direct prospecting",
          "outbound",
          "personally source",
          "personally win"
        ]
      },
      "S1.Q05": {
        "kind": "primary_activity_same_scope",
        "activityLexemes": [
          "store sales",
          "store management",
          "retail store"
        ]
      },
      "S1.Q06": {
        "kind": "closed_direct_employer_lexeme"
      },
      "S1.Q07": {
        "kind": "closed_direct_employer_lexeme",
        "employerLexemes": [
          "church",
          "ministry",
          "faith-based organization",
          "religious organization",
          "religion"
        ]
      },
      "S2.F2.Q12": {
        "kind": "partnership_management_same_scope",
        "actionLexemes": [
          "manage",
          "manages",
          "managing",
          "develop",
          "develops",
          "developing",
          "grow",
          "grows",
          "growing",
          "own",
          "owns",
          "owning"
        ],
        "partnerLexemes": [
          "partner",
          "partners",
          "partnership",
          "partnerships",
          "alliance",
          "alliances"
        ]
      },
      "S2.F3.Q3": {
        "kind": "same_scope_lexeme",
        "requiredLexemes": [
          "outbound",
          "prospecting",
          "cold call",
          "cold calling",
          "cold outreach"
        ]
      }
    },
    "accountabilityLexemes": [
      "own",
      "owns",
      "accountable",
      "accountability",
      "responsible",
      "responsibility",
      "target",
      "quota"
    ],
    "finalAuthorityLexemes": [
      "final",
      "approve",
      "approval",
      "decision authority",
      "decision-making authority"
    ]
  },
  "compensation": {
    "normalizationVersion": "aim-compensation-normalization-v1",
    "comparisonCurrency": "USD",
    "acceptedExplicitCurrencyMarkers": [
      "USD",
      "US$"
    ],
    "bareDollarEstablishesCurrency": false,
    "foreignExchangeAllowed": false,
    "amountStorage": "integer_cents",
    "percentageArithmetic": "exact_decimal",
    "rounding": "half_up_after_multiplication",
    "annualization": {
      "annual": {
        "multiplier": 1
      },
      "monthly_fixed": {
        "multiplier": 12
      },
      "weekly_fixed": {
        "multiplier": 52
      },
      "hourly_fixed": {
        "explicitScheduledAnnualHoursAllowed": true,
        "fullTimeDefaultAnnualHours": 2080,
        "requiresValidatedFullTimeEvidenceForDefault": true
      },
      "otherOrAmbiguous": "non_comparable"
    },
    "geographyPrecedence": [
      "exact_role_city_state",
      "minnesota_for_minnesota_or_minnesota_eligible_nationwide_remote",
      "nationwide_united_states",
      "unqualified_role_wide"
    ],
    "equalSpecificityConflict": "non_comparable",
    "includedRecurringCashTypes": [
      "fixed_base",
      "explicit_ote",
      "explicit_total_cash",
      "quantified_recurring_target_bonus",
      "quantified_recurring_guaranteed_bonus",
      "quantified_recurring_target_variable",
      "quantified_recurring_guaranteed_variable",
      "nonrecoverable_guaranteed_cash_draw"
    ],
    "excludedTypes": [
      "equity",
      "stock",
      "benefits",
      "sign_on",
      "one_time_award",
      "recoverable_draw",
      "unquantified_profit_sharing",
      "noncash_total_compensation",
      "commission_percentage_without_quantified_sales_basis"
    ],
    "uncappedTreatment": {
      "preventsBelowFloorUpperBound": true,
      "doesNotBlockProvenThreshold": true
    },
    "maximumTotalCashAllowedProofs": [
      "applicable_explicit_total_cash_range",
      "cash_only_exhaustive_total_compensation_range",
      "explicit_maximum_or_cap",
      "exhaustive_fixed_plus_quantified_variable"
    ],
    "ordinaryOteIsMaximum": false,
    "baseOnlyIsMaximumWithoutExplicitNoOtherRecurringCash": false,
    "floorCents": 6000000,
    "exactFloorSurvives": true,
    "failOpenStates": [
      "base_only_below_floor",
      "ote_below_floor_without_cap",
      "unquantified_variable",
      "uncapped_variable",
      "unclear_included_components",
      "missing",
      "bare_dollar",
      "non_usd",
      "ambiguous_period",
      "ambiguous_location",
      "equally_specific_conflict",
      "coverage_ambiguous"
    ],
    "preferencePointTiers": [
      {
        "minimumReferenceCents": 10000000,
        "points": 2
      },
      {
        "minimumReferenceCents": 6000000,
        "points": 1
      },
      {
        "minimumReferenceCents": 0,
        "points": 0
      }
    ],
    "referenceCashSelection": "maximum_comparable_applicable_recurring_reference_or_proven_guaranteed_lower_bound",
    "lexicalCoverageFailure": "non_comparable_zero_points_fail_open"
  },
  "travel": {
    "normalizationVersion": "aim-travel-normalization-v1",
    "coverageScannerVersion": "aim-travel-coverage-v1",
    "travelLexemes": [
      "travel",
      "travels",
      "traveling",
      "travelling"
    ],
    "numericQualifiers": {
      "lowerBound": [
        "at least",
        "minimum",
        "minimum of"
      ],
      "upperBound": [
        "up to",
        "up-to",
        "at most",
        "at-most",
        "maximum",
        "maximum of",
        "no more than",
        "not to exceed"
      ],
      "rangeSeparators": [
        "-",
        "–",
        "—",
        "to",
        "through"
      ]
    },
    "qualitativeLexemes": {
      "frequent": 8,
      "extensive": 8,
      "periodic": 5,
      "regular": 5,
      "as needed": 3,
      "as-needed": 3,
      "occasional": 2
    },
    "unknownQualifierOutcome": "ambiguous_zero_numeric_intensity",
    "domainMinimumPercent": 0,
    "domainMaximumPercent": 100,
    "affirmativeFloorIntensityTiers": [
      {
        "minimum": 50,
        "maximum": 100,
        "points": 10
      },
      {
        "minimum": 30,
        "maximum": 49,
        "points": 8
      },
      {
        "minimum": 20,
        "maximum": 29,
        "points": 6
      },
      {
        "minimum": 10,
        "maximum": 19,
        "points": 4
      },
      {
        "minimum": 1,
        "maximum": 9,